{
    "request_id": "req_metal_001",
    "lyrics": "[00:00.00] Intro\n[00:05.00] Thunder roars across the blackened sky\n[00:10.00] Warriors march as kingdoms fall and die\n[00:15.00] Steel and fire clash in endless night\n[00:20.00] We stand together ready for the fight\n\n[00:25.00] Chorus\n[00:26.00] Rise from the ashes\n[00:30.00] Scream into the void\n[00:35.00] Nothing can break us\n[00:40.00] We won't be destroyed\n\n[00:45.00] Verse\n[00:50.00] Chains of fate try to hold us down\n[00:55.00] But we're breaking free we'll take the crown\n[01:00.00] Blood and honor fuel our burning rage\n[01:05.00] This is our moment this is our stage\n\n[01:10.00] Chorus\n[01:11.00] Rise from the ashes\n[01:15.00] Scream into the void\n[01:20.00] Nothing can break us\n[01:25.00] We won't be destroyed",
    "genre": "metal",
    "duration": 95
}