{
    "request_id": "req_indie_arctic_006",
    "lyrics": "[00:00.00] Intro\n[00:10.00] Verse 1\n[00:12.00] Cigarette smoke in the neon glow\n[00:16.00] Dancing shadows where the lost souls go\n[00:20.00] Your leather jacket and that crooked smile\n[00:24.00] Haven't seen you in a little while\n[00:30.00] Pre-Chorus\n[00:32.00] The city's calling but we're standing still\n[00:36.00] Chasing dreams we never will fulfill\n[00:42.00] Chorus\n[00:44.00] We're just silhouettes in the midnight rain\n[00:48.00] Running from the truth and the endless pain\n[00:52.00] Electric hearts in a concrete maze\n[00:56.00] Living for the night, sleeping through the days\n[01:02.00] Verse 2\n[01:04.00] Broken bottles on the avenue\n[01:08.00] Graffiti walls telling stories true\n[01:12.00] Your whispered words in the cold night air\n[01:16.00] Pretending like we just don't care\n[01:22.00] Pre-Chorus\n[01:24.00] The city's calling but we're standing still\n[01:28.00] Chasing dreams we never will fulfill\n[01:34.00] Chorus\n[01:36.00] We're just silhouettes in the midnight rain\n[01:40.00] Running from the truth and the endless pain\n[01:44.00] Electric hearts in a concrete maze\n[01:48.00] Living for the night, sleeping through the days\n[01:54.00] Bridge\n[01:56.00] And when the morning comes we'll fade away\n[02:00.00] Like yesterday's mistakes we can't replay\n[02:04.00] The streetlights dim and the music dies\n[02:08.00] But we'll be back beneath these starless skies\n[02:14.00] Guitar Solo\n[02:34.00] Verse 3\n[02:36.00] Your reflection in the window pane\n[02:40.00] Dancing slowly in the pouring rain\n[02:44.00] We're just ghosts of who we used to be\n[02:48.00] Lost in this electric reverie\n[02:54.00] Final Chorus\n[02:56.00] We're just silhouettes in the midnight rain\n[03:00.00] Running from the truth and the endless pain\n[03:04.00] Electric hearts in a concrete maze\n[03:08.00] Living for the night, sleeping through the days\n[03:14.00] We're just silhouettes in the midnight rain\n[03:18.00] Running from the truth and the endless pain\n[03:22.00] Electric hearts in a concrete maze\n[03:26.00] Living for the night, sleeping through the days\n[03:32.00] Outro\n[03:34.00] Silhouettes in the rain\n[03:38.00] Silhouettes in the rain\n[03:42.00] We're just silhouettes\n[03:46.00] Silhouettes in the rain",
    "genre": "indie",
    "duration": 285
}