{
    "request_id": "req_rock_001",
    "lyrics": "[00:00.00] Verse 1\n[00:05.00] Walking through the shadows of my mind\n[00:10.00] Searching for the truth I left behind\n[00:15.00] Every step I take feels so unclear\n[00:20.00] But I know that change is drawing near\n\n[00:25.00] Chorus\n[00:26.00] I will rise above the pain\n[00:30.00] Break these chains and start again\n[00:35.00] No more living in the past\n[00:40.00] This time I will make it last\n\n[00:45.00] Verse 2\n[00:50.00] Facing all the demons that I fear\n[00:55.00] Finding strength when no one else is here\n[01:00.00] Every scar reminds me I'm alive\n[01:05.00] And I'm ready now to finally thrive",
    "genre": "rock",
    "duration": 95
}